{
  "id": "EXP-0003",
  "specialist": "Fire",
  "created_at": "2026-08-13T23:36:48.136084+00:00",
  "updated_at": "2026-08-14T01:52:01.316359+00:00",
  "worker": "codex",
  "hypothesis": "For Mega Charizard X ex and Mega Charizard Y ex only, estimate effect-driven attack damage and required Energy discard in lethal, attack, and immediate-attacker ranking instead of treating their printed zero damage as zero; preserve all other attack logic.",
  "expected_effect": "Choose powered Charizard attacks and promotions when their live effect damage is tactically superior, without changing unrelated Pokemon.",
  "mechanisms": [
    "charizard_effect_damage_evaluation_v2"
  ],
  "files_changed": [
    "main.py"
  ],
  "baseline_version": "v000-baseline",
  "candidate_version": "v001-candidate",
  "accepted_version": null,
  "baseline_path": "snapshots/v000-baseline",
  "candidate_path": "experiments/EXP-0003/candidate",
  "status": "REVIEW_REQUIRED",
  "smoke_result": {
    "specialist": "Fire",
    "candidate_version": "v001-candidate",
    "baseline_version": "v000-baseline",
    "opponent": "specialist_previous",
    "stage": "smoke",
    "seed_set": "1406264938",
    "games": 20,
    "wins": 11,
    "losses": 9,
    "draws": 0,
    "timeouts": 0,
    "illegal_actions": 0,
    "crashes": 0,
    "average_steps": 93.0,
    "average_decision_time_ms": 3.5273499999382425,
    "max_decision_time_ms": 84.42610000201967,
    "win_rate": 0.55,
    "confidence_interval": [
      0.3420820083075997,
      0.7418049791429071
    ],
    "z_score": 0.44721359549995837,
    "p_value": 0.6547208460185767,
    "started_at": "2026-08-13T23:40:38.653222+00:00",
    "finished_at": "2026-08-13T23:40:46.815890+00:00",
    "duration_seconds": 8.150885600000038,
    "errors": []
  },
  "screening_result": {
    "specialist": "Fire",
    "candidate_version": "v001-candidate",
    "baseline_version": "v000-baseline",
    "opponent": "specialist_previous",
    "stage": "screening",
    "seed_set": "1406264939",
    "games": 200,
    "wins": 107,
    "losses": 93,
    "draws": 0,
    "timeouts": 0,
    "illegal_actions": 0,
    "crashes": 0,
    "average_steps": 97.795,
    "average_decision_time_ms": 4.164171300924312,
    "max_decision_time_ms": 252.46770000376273,
    "win_rate": 0.535,
    "confidence_interval": [
      0.46586521028994954,
      0.6028155692957681
    ],
    "z_score": 0.9899494936611675,
    "p_value": 0.3221988061625811,
    "started_at": "2026-08-13T23:40:47.230286+00:00",
    "finished_at": "2026-08-13T23:42:14.817891+00:00",
    "duration_seconds": 87.59767049999209,
    "errors": []
  },
  "main_result": null,
  "confirmation_result": null,
  "cross_deck_results": [],
  "decision_traces": [
    {
      "stage": "screening",
      "result": "results/decision-trace-screening.json",
      "log": "orchestration-logs/decision-trace-screening.log",
      "games": 20,
      "total_differences": 24,
      "difference_rate": 0.02120141342756184
    }
  ],
  "runs": [
    {
      "stage": "smoke",
      "games": 20,
      "seed": 1406264938,
      "started_at": "2026-08-13T23:40:38.466549+00:00",
      "finished_at": "2026-08-13T23:40:46.835024+00:00",
      "returncode": 0,
      "result": "results/smoke-001.json",
      "log": "logs/smoke-001.log",
      "timed_out": false
    },
    {
      "stage": "screening",
      "games": 200,
      "seed": 1406264939,
      "started_at": "2026-08-13T23:40:47.073957+00:00",
      "finished_at": "2026-08-13T23:42:14.851752+00:00",
      "returncode": 0,
      "result": "results/screening-002.json",
      "log": "logs/screening-002.log",
      "timed_out": false
    }
  ],
  "worker_runs": [
    {
      "run": 1,
      "provider": "codex",
      "backend": "codex-cli",
      "model": null,
      "started_at": "2026-08-13T23:36:48.536108+00:00",
      "finished_at": "2026-08-13T23:40:38.185398+00:00",
      "dry_run": false,
      "returncode": 0,
      "timed_out": false,
      "candidate_imported": true,
      "changed_files": [
        "main.py"
      ],
      "validation_errors": [],
      "run_dir": "workers/001-codex"
    }
  ],
  "orchestration": {
    "state": "REVIEW_REQUIRED",
    "provider": "codex",
    "through_stage": "screening",
    "started_at": "2026-08-13T23:36:48.219636+00:00",
    "updated_at": "2026-08-14T01:52:01.316359+00:00",
    "review_pack": "human-review/pending/Fire-EXP-0003.md",
    "ai_review_state": "more_evidence",
    "ai_review_reviewer": "opus",
    "ai_review_artifact": "reviews/screening-opus-auto-review.json"
  },
  "reviews": [
    {
      "stage": "screening",
      "status": "pending",
      "created_at": "2026-08-13T23:42:32.501704+00:00",
      "json": "human-review/pending/Fire-EXP-0003.json",
      "markdown": "human-review/pending/Fire-EXP-0003.md"
    }
  ],
  "review_history": [
    {
      "stage": "screening",
      "decision": "more_evidence",
      "reviewer": "opus",
      "reason": "automatic AI review; see reviews/screening-opus-auto-review.json",
      "at": "2026-08-14T01:52:01.316359+00:00"
    }
  ],
  "decision": "pending",
  "reason": "",
  "limitations": []
}
