{
  "id": "EXP-0002",
  "specialist": "Hydrapple",
  "created_at": "2026-08-12T17:53:29.153140+00:00",
  "updated_at": "2026-08-12T17:53:29.603061+00:00",
  "worker": "codex",
  "hypothesis": "Verify all configured provider adapters create isolated, bounded worker invocations without calling a model",
  "expected_effect": "Each adapter should resolve, package identical scoped context, and leave candidate and accepted files unchanged in dry-run mode",
  "mechanisms": [
    "provider_orchestration"
  ],
  "files_changed": [],
  "baseline_version": "v000-baseline",
  "candidate_version": "v001-candidate",
  "accepted_version": null,
  "baseline_path": "snapshots/v000-baseline",
  "candidate_path": "experiments/EXP-0002/candidate",
  "status": "PROPOSED",
  "smoke_result": null,
  "screening_result": null,
  "main_result": null,
  "confirmation_result": null,
  "cross_deck_results": [],
  "runs": [],
  "worker_runs": [
    {
      "run": 1,
      "provider": "codex",
      "backend": "codex-cli",
      "model": null,
      "started_at": "2026-08-12T17:53:29.603061+00:00",
      "finished_at": "2026-08-12T17:53:29.603061+00:00",
      "dry_run": true,
      "returncode": null,
      "timed_out": false,
      "candidate_imported": false,
      "changed_files": [],
      "validation_errors": [],
      "run_dir": "workers/001-codex"
    }
  ],
  "decision": "pending",
  "reason": "",
  "limitations": []
}
