{
  "id": "EXP-0002",
  "specialist": "Fire",
  "created_at": "2026-08-12T23:24:48.347344+00:00",
  "updated_at": "2026-08-12T23:24:48.431120+00:00",
  "worker": "codex",
  "hypothesis": "When choosing or evaluating attacks for Mega Charizard X ex and Mega Charizard Y ex, estimate their effect-driven damage and required Energy discard instead of treating zero printed damage as zero value; preserve all non-Charizard attack logic.",
  "expected_effect": "Use powered Charizard attacks at tactically correct times instead of underrating dynamic damage.",
  "mechanisms": [
    "charizard_effect_damage_evaluation"
  ],
  "files_changed": [],
  "baseline_version": "v000-baseline",
  "candidate_version": "v001-candidate",
  "accepted_version": null,
  "baseline_path": "snapshots/v000-baseline",
  "candidate_path": "experiments/EXP-0002/candidate",
  "status": "PROPOSED",
  "smoke_result": null,
  "screening_result": null,
  "main_result": null,
  "confirmation_result": null,
  "cross_deck_results": [],
  "decision_traces": [],
  "runs": [],
  "worker_runs": [],
  "orchestration": {
    "state": "RUNNING",
    "provider": "codex",
    "through_stage": "screening",
    "started_at": "2026-08-12T23:24:48.431120+00:00",
    "updated_at": "2026-08-12T23:24:48.431120+00:00"
  },
  "reviews": [],
  "review_history": [],
  "decision": "pending",
  "reason": "",
  "limitations": []
}
