{
  "id": "EXP-0007",
  "specialist": "PalSystem_Dragapult",
  "created_at": "2026-08-15T01:58:36.859008+00:00",
  "updated_at": "2026-08-15T02:08:43.772514+00:00",
  "worker": "codex",
  "hypothesis": "Replay-curated PalSystem games show Dreepy is the dominant successful opener and first setup body. For opening Active and initial setup Bench CARD selections only, prefer Dreepy first, then Munkidori/Budew as fallback support, while keeping Fezandipiti ex and Meowth ex off Active unless no better Basic is available; preserve all MAIN-phase play, Energy, Trainer, Ability, attack, evolution, and damage-target logic unchanged.",
  "expected_effect": "Increase stable Dragapult-line setup without bundling speculative Energy or Trainer changes; decision traces must prove the changed decisions are opening/setup CARD selections and not unrelated cascade differences.",
  "mechanisms": [
    "dreepy_first_opening_setup_only"
  ],
  "files_changed": [
    "main.py"
  ],
  "baseline_version": "v000-baseline",
  "candidate_version": "v001-candidate",
  "accepted_version": null,
  "baseline_path": "snapshots/v000-baseline",
  "candidate_path": "experiments/EXP-0007/candidate",
  "status": "COMPLETE",
  "smoke_result": {
    "specialist": "PalSystem_Dragapult",
    "candidate_version": "v001-candidate",
    "baseline_version": "v000-baseline",
    "opponent": "specialist_previous",
    "stage": "smoke",
    "seed_set": "2026081512",
    "games": 20,
    "wins": 10,
    "losses": 10,
    "draws": 0,
    "timeouts": 0,
    "illegal_actions": 0,
    "crashes": 0,
    "average_steps": 203.0,
    "average_decision_time_ms": 8.648972376220915,
    "max_decision_time_ms": 157.64269999635871,
    "win_rate": 0.5,
    "confidence_interval": [
      0.2992949144298199,
      0.7007050855701801
    ],
    "z_score": 0.0,
    "p_value": 1.0,
    "started_at": "2026-08-15T02:02:45.675919+00:00",
    "finished_at": "2026-08-15T02:03:23.858590+00:00",
    "duration_seconds": 38.17841419999604,
    "errors": []
  },
  "screening_result": {
    "specialist": "PalSystem_Dragapult",
    "candidate_version": "v001-candidate",
    "baseline_version": "v000-baseline",
    "opponent": "specialist_previous",
    "stage": "screening",
    "seed_set": "2026081513",
    "games": 200,
    "wins": 96,
    "losses": 104,
    "draws": 0,
    "timeouts": 0,
    "illegal_actions": 0,
    "crashes": 0,
    "average_steps": 198.875,
    "average_decision_time_ms": 6.007182478059199,
    "max_decision_time_ms": 196.66790000337642,
    "win_rate": 0.48,
    "confidence_interval": [
      0.4117904407948983,
      0.5489633994418346
    ],
    "z_score": -0.5656854249492386,
    "p_value": 0.5716076449533313,
    "started_at": "2026-08-15T02:03:24.369718+00:00",
    "finished_at": "2026-08-15T02:07:39.310059+00:00",
    "duration_seconds": 254.94047920000594,
    "errors": []
  },
  "main_result": null,
  "confirmation_result": null,
  "cross_deck_results": [],
  "decision_traces": [
    {
      "stage": "screening",
      "result": "results/decision-trace-screening.json",
      "log": "orchestration-logs/decision-trace-screening.log",
      "games": 20,
      "total_differences": 127,
      "difference_rate": 0.06694781233526621
    }
  ],
  "runs": [
    {
      "stage": "smoke",
      "games": 20,
      "seed": 2026081512,
      "started_at": "2026-08-15T02:02:45.530829+00:00",
      "finished_at": "2026-08-15T02:03:23.885636+00:00",
      "returncode": 0,
      "result": "results/smoke-001.json",
      "log": "logs/smoke-001.log",
      "timed_out": false
    },
    {
      "stage": "screening",
      "games": 200,
      "seed": 2026081513,
      "started_at": "2026-08-15T02:03:24.179205+00:00",
      "finished_at": "2026-08-15T02:07:39.333748+00:00",
      "returncode": 0,
      "result": "results/screening-002.json",
      "log": "logs/screening-002.log",
      "timed_out": false
    }
  ],
  "worker_runs": [
    {
      "run": 1,
      "provider": "codex",
      "backend": "codex-cli",
      "model": "gpt-5.5",
      "started_at": "2026-08-15T01:58:37.289669+00:00",
      "finished_at": "2026-08-15T02:02:45.275005+00:00",
      "dry_run": false,
      "returncode": 0,
      "timed_out": false,
      "candidate_imported": true,
      "changed_files": [
        "main.py"
      ],
      "validation_errors": [],
      "run_dir": "workers/001-codex"
    }
  ],
  "orchestration": {
    "state": "REJECTED_BY_HUMAN",
    "provider": "codex",
    "through_stage": "screening",
    "started_at": "2026-08-15T01:58:36.909501+00:00",
    "updated_at": "2026-08-15T02:08:43.588111+00:00",
    "review_pack": "human-review/rejected/PalSystem_Dragapult-EXP-0007.md"
  },
  "reviews": [
    {
      "stage": "screening",
      "status": "rejected",
      "created_at": "2026-08-15T02:08:19.807503+00:00",
      "worker_identity": "codex",
      "assigned_reviewer": {
        "reviewer": "opus",
        "provider": "claude",
        "model": "opus",
        "reason": "Codex-authored experiments require an independent Opus/Claude review."
      },
      "json": "human-review/rejected/PalSystem_Dragapult-EXP-0007.json",
      "markdown": "human-review/rejected/PalSystem_Dragapult-EXP-0007.md",
      "reviewed_at": "2026-08-15T02:08:43.562272+00:00",
      "reason": "Rejected after replay-inspired setup screen: candidate went 96/200 (48.0%, p=0.572) and decision trace showed 127 differences all in MAIN/MAIN, not opening/setup CARD contexts. The implementation did not isolate the stated Dreepy-first setup mechanism, so deeper evaluation would not answer the replay hypothesis."
    }
  ],
  "review_history": [
    {
      "stage": "screening",
      "decision": "rejected",
      "reason": "Rejected after replay-inspired setup screen: candidate went 96/200 (48.0%, p=0.572) and decision trace showed 127 differences all in MAIN/MAIN, not opening/setup CARD contexts. The implementation did not isolate the stated Dreepy-first setup mechanism, so deeper evaluation would not answer the replay hypothesis.",
      "at": "2026-08-15T02:08:43.588111+00:00"
    }
  ],
  "decision": "rejected",
  "reason": "human review rejection: Rejected after replay-inspired setup screen: candidate went 96/200 (48.0%, p=0.572) and decision trace showed 127 differences all in MAIN/MAIN, not opening/setup CARD contexts. The implementation did not isolate the stated Dreepy-first setup mechanism, so deeper evaluation would not answer the replay hypothesis.",
  "limitations": []
}
