{
  "id": "EXP-0001",
  "specialist": "My_Deck_Grass",
  "created_at": "2026-08-16T03:31:52.861648+00:00",
  "updated_at": "2026-08-16T03:38:39.154402+00:00",
  "worker": "claude",
  "hypothesis": "Baseline instrumentation pass: measure deck tempo, trainer usage and Meganium presence for the unchanged generic agent on My_Deck_Grass",
  "expected_effect": "No behavioural change; establishes the frozen v000-baseline snapshot and the diagnostic numbers later phases must beat",
  "mechanisms": [
    "infrastructure_baseline"
  ],
  "files_changed": [],
  "baseline_version": "v000-baseline",
  "candidate_version": "v001-candidate",
  "accepted_version": null,
  "baseline_path": "snapshots/v000-baseline",
  "candidate_path": "experiments/EXP-0001/candidate",
  "status": "COMPLETE",
  "smoke_result": null,
  "screening_result": null,
  "main_result": null,
  "confirmation_result": null,
  "cross_deck_results": [],
  "decision_traces": [],
  "runs": [],
  "worker_runs": [],
  "orchestration": {},
  "reviews": [],
  "review_history": [],
  "decision": "rejected",
  "reason": "Diagnostics-only pass: candidate is byte-identical to baseline. Purpose was to freeze snapshots/v000-baseline and collect setup/tempo/play censuses. No gameplay change, so nothing to accept.",
  "limitations": []
}
