{
  "id": "EXP-0001",
  "specialist": "Hydrapple",
  "created_at": "2026-08-12T16:10:48.823740+00:00",
  "updated_at": "2026-08-12T16:11:16.151442+00:00",
  "worker": "codex",
  "hypothesis": "Verify the bounded experiment lifecycle with an unchanged candidate",
  "expected_effect": "Candidate and baseline should remain behaviorally equivalent",
  "mechanisms": [
    "infrastructure_smoke"
  ],
  "files_changed": [],
  "baseline_version": "v000-baseline",
  "candidate_version": "v001-candidate",
  "accepted_version": null,
  "baseline_path": "snapshots/v000-baseline",
  "candidate_path": "experiments/EXP-0001/candidate",
  "status": "COMPLETE",
  "smoke_result": {
    "specialist": "Hydrapple",
    "candidate_version": "v001-candidate",
    "baseline_version": "v000-baseline",
    "opponent": "specialist_previous",
    "stage": "smoke",
    "seed_set": "20260812",
    "games": 2,
    "wins": 1,
    "losses": 1,
    "draws": 0,
    "timeouts": 0,
    "illegal_actions": 0,
    "crashes": 0,
    "average_steps": 115.0,
    "average_decision_time_ms": 4.8572957978443,
    "max_decision_time_ms": 40.11290002381429,
    "win_rate": 0.5,
    "confidence_interval": [
      0.09452865480086614,
      0.9054713451991339
    ],
    "z_score": 0.0,
    "p_value": 1.0,
    "started_at": "2026-08-12T16:11:01.870784+00:00",
    "finished_at": "2026-08-12T16:11:03.848453+00:00",
    "duration_seconds": 1.9745608000084758,
    "errors": []
  },
  "screening_result": null,
  "main_result": null,
  "confirmation_result": null,
  "cross_deck_results": [],
  "runs": [
    {
      "stage": "smoke",
      "games": 2,
      "seed": 20260812,
      "started_at": "2026-08-12T16:11:01.720305+00:00",
      "finished_at": "2026-08-12T16:11:03.865603+00:00",
      "returncode": 0,
      "result": "results/smoke-001.json",
      "log": "logs/smoke-001.log",
      "timed_out": false
    }
  ],
  "decision": "rejected",
  "reason": "Infrastructure-only unchanged candidate; the 2-game seat-balanced smoke run passed 1-1 with zero crashes, illegal actions, draws, or timeouts, but contains no strategic improvement to accept.",
  "limitations": []
}
