{
  "id": "EXP-0014",
  "specialist": "My_Deck_Grass",
  "created_at": "2026-08-16T15:17:14.323735+00:00",
  "updated_at": "2026-08-16T15:29:55.781182+00:00",
  "worker": "claude",
  "hypothesis": "Retest of the operator's promotion policy with my two encoding errors fixed. EXP-0013 scored 32.5% because the 'keep Ogerpon Benched' rule was an unconditional -900, burying a charged 210 HP Ogerpon below a 70 HP Chikorita, and the sacrifice branch evaluated 'doomed' per candidate so it rewarded fragility. Corrected: the Ogerpon and Fezandipiti positional penalties apply ONLY when another benched Pokemon can actually attack, and the sacrifice branch triggers once for the situation, on whether the opponent can knock out our best option.",
  "expected_effect": "Promotion follows deck roles without ever passing over the only viable attacker: KO-capable first; Ogerpon held back only when a real alternative exists; Meowth ex as a Tuck Tail escape when the bench cannot attack; Fezandipiti ex only as a conditional sniper; cheapest non-Rule-Box duplicate as the chump when every option dies anyway.",
  "mechanisms": [
    "deck_promotion_policy_v2"
  ],
  "files_changed": [
    "main.py"
  ],
  "baseline_version": "v001-accepted",
  "candidate_version": "v002-candidate",
  "accepted_version": null,
  "baseline_path": "snapshots/v001-accepted",
  "candidate_path": "experiments/EXP-0014/candidate",
  "status": "COMPLETE",
  "smoke_result": {
    "specialist": "My_Deck_Grass",
    "candidate_version": "v002-candidate",
    "baseline_version": "v001-accepted",
    "opponent": "specialist_previous",
    "stage": "smoke",
    "seed_set": "20260812",
    "games": 20,
    "wins": 7,
    "losses": 13,
    "draws": 0,
    "timeouts": 0,
    "illegal_actions": 0,
    "crashes": 0,
    "average_steps": 170.1,
    "average_decision_time_ms": 17.90244032051118,
    "max_decision_time_ms": 364.55500000010943,
    "win_rate": 0.35,
    "confidence_interval": [
      0.18118954786794464,
      0.5671494897805354
    ],
    "z_score": -1.341640786499874,
    "p_value": 0.17971249487899985,
    "started_at": "2026-08-16T15:19:58.751585+00:00",
    "finished_at": "2026-08-16T15:21:04.686024+00:00",
    "duration_seconds": 65.92844470000273,
    "errors": []
  },
  "screening_result": {
    "specialist": "My_Deck_Grass",
    "candidate_version": "v002-candidate",
    "baseline_version": "v001-accepted",
    "opponent": "specialist_previous",
    "stage": "screening",
    "seed_set": "20260812",
    "games": 200,
    "wins": 75,
    "losses": 125,
    "draws": 0,
    "timeouts": 0,
    "illegal_actions": 0,
    "crashes": 0,
    "average_steps": 159.355,
    "average_decision_time_ms": 16.327972041437505,
    "max_decision_time_ms": 671.0190999947372,
    "win_rate": 0.375,
    "confidence_interval": [
      0.3108532530524515,
      0.44385824842712884
    ],
    "z_score": -3.5355339059327378,
    "p_value": 0.000406952017444959,
    "started_at": "2026-08-16T15:21:23.767185+00:00",
    "finished_at": "2026-08-16T15:29:29.467786+00:00",
    "duration_seconds": 485.6969504000008,
    "errors": []
  },
  "main_result": null,
  "confirmation_result": null,
  "cross_deck_results": [],
  "decision_traces": [],
  "runs": [
    {
      "stage": "smoke",
      "games": 20,
      "seed": 20260812,
      "started_at": "2026-08-16T15:19:58.501237+00:00",
      "finished_at": "2026-08-16T15:21:04.718353+00:00",
      "returncode": 0,
      "result": "results/smoke-001.json",
      "log": "logs/smoke-001.log",
      "timed_out": false
    },
    {
      "stage": "screening",
      "games": 200,
      "seed": 20260812,
      "started_at": "2026-08-16T15:21:23.633397+00:00",
      "finished_at": "2026-08-16T15:29:29.498382+00:00",
      "returncode": 0,
      "result": "results/screening-002.json",
      "log": "logs/screening-002.log",
      "timed_out": false
    }
  ],
  "worker_runs": [],
  "orchestration": {},
  "reviews": [],
  "review_history": [],
  "decision": "rejected",
  "reason": "Still strongly negative after both encoding errors were fixed, so the policy itself is harmful on this deck rather than merely miscoded. Screening 75-125 (37.5%), smoke 7-13 (35.0%), zero faults. For comparison the miscoded EXP-0013 scored 32.5% screening and 35.0% main (105-195, p=2e-7). The corrected version verifies against a self-check that pins the exact EXP-0013 failure (a charged Ogerpon must outrank a 70 HP Chikorita) plus the operator's scenario and the sacrifice case, and it is non-inert (16 of 29 TO_ACTIVE selections differ). Working diagnosis: magnitude, not direction. _live_attacker_score spans roughly -50 to 5000 and is dominated by HP and usable damage; adjustments of plus or minus 900 to 4000 override that signal wholesale, so even a correctly-directed rule swamps the information the baseline was using. Running a single-rule ablation to isolate which of the three rules carries the loss before spending anything further on this context, which has now cost roughly 1200 games across three experiments.",
  "limitations": []
}
